{
  "challenges": [
    "La fecha de conteo igual al as_of demuestra consistencia interna del snapshot, no on-hand actual ni frescura después de ese corte.",
    "La cobertura de 30 días, el umbral de 42 días y las cantidades en tránsito son escenarios de análisis; no prueban forecast, preferencia de color/talla ni necesidad de compra."
  ],
  "evidence_hash": "a3a5428f9fd4eecd8e8333408f4a4827ee84b731fca864eac3e6860f2df166ff",
  "facts": [
    {
      "evidence_refs": [
        "/marts/inventory_position/32/cover_days"
      ],
      "id": "rose_s_lowest_cover",
      "kind": "observation",
      "statement": "Grip Pilates Socks Rose talla S reporta 46.67 días de cobertura sintética.",
      "value": 46.67
    },
    {
      "evidence_refs": [
        "/marts/inventory_position/24/cover_days"
      ],
      "id": "ivory_l_second_cover",
      "kind": "observation",
      "statement": "Grip Pilates Socks Ivory talla L reporta 49.41 días de cobertura sintética.",
      "value": 49.41
    },
    {
      "evidence_refs": [
        "/marts/inventory_position/30/cover_days"
      ],
      "id": "rose_l_alternative_cover",
      "kind": "observation",
      "statement": "Grip Pilates Socks Rose talla L reporta 210.0 días de cobertura sintética.",
      "value": 210.0
    },
    {
      "evidence_refs": [
        "/marts/procurement/12/open_qty"
      ],
      "id": "rose_open_receipt_offset",
      "kind": "observation",
      "statement": "La orden po-00007 de Grip Pilates Socks Rose talla S reporta 10 unidades abiertas en procurement sintético.",
      "value": 10
    },
    {
      "evidence_refs": [
        "/marts/inventory_position/32/count_date"
      ],
      "id": "snapshot_count_date",
      "kind": "observation",
      "statement": "El conteo de la variante Rose talla S está fechado 2026-09-21 dentro del snapshot.",
      "value": "2026-09-21"
    },
    {
      "evidence_refs": [
        "/marts/inventory_position"
      ],
      "id": "inventory_capital_and_concentration",
      "kind": "inference",
      "statement": "Cálculo sobre inventory_position: SUM(inventory_value_cents)=12,836,500; las calcetas suman 3,712,800 (28.9%) y leggings 3,696,000 (28.8%) centavos MXN. Es valuación sintética de costo, no capital de trabajo real.",
      "value": null
    },
    {
      "evidence_refs": [
        "/marts/inventory_position",
        "/marts/procurement"
      ],
      "id": "provisional_reorder_baseline",
      "kind": "inference",
      "statement": "Al ordenar las 36 variantes launched por cover_days, Rose S (46.67) es la menor. Bajo el escenario provisional explícito de 21 días de lead time + 21 días de seguridad=42 días, ninguna variante launched cruza el umbral; las 10 unidades abiertas/en tránsito de Rose S y las 12 de Ivory L refuerzan que el baseline no pide recompra. Es una regla de escenario, no un forecast real.",
      "value": null
    }
  ],
  "hypotheses": [
    "La menor cobertura de Rose S puede venir de la señal generada de mix color/talla y no de preferencia observada.",
    "El tránsito y las cantidades abiertas pueden resolver la necesidad simulada sin compra nueva, pero su recepción real requiere evidencia externa."
  ],
  "recommendations": [
    {
      "action": "Presentar al responsable del negocio el baseline provisional de 42 días (21 lead time + 21 seguridad): no proponer recompra para ninguna variante launched en este snapshot y mantener Rose S e Ivory L en vigilancia prioritaria; no crear, aprobar ni enviar una orden.",
      "approval_required": true,
      "closure_rule": "El responsable del negocio decide una compra sólo cuando la cobertura real cruce el umbral y exista conteo, tránsito, costo, MOQ, fecha de entrega y fuente de caja aprobados.",
      "evidence_refs": [
        "/marts/inventory_position",
        "/marts/procurement"
      ],
      "execution": "PROHIBITED",
      "guardrail": "Bloquear el baseline si falta conteo físico, ventas reales, cobertura conocida, costo, lead time o presupuesto; excluir PRELAUNCH y clearance de la regla de recompra.",
      "id": "rank-1-no-buy-baseline",
      "population": "Las 36 variantes launched; foco analítico en Rose S, Ivory L, Ivory M, Ivory S y Sage S, las cinco coberturas más bajas del snapshot.",
      "primary_metric": "cover_days por variante frente al umbral provisional de 42 días",
      "window": "21 días de lead time más 21 días de seguridad; revisión de un corte real semanal durante 30 días."
    },
    {
      "action": "Proponer un registro analítico de 30 días para comparar ventas netas reales, disponibilidad y agotados de Rose S contra Ivory L, Rose M, Rose L y Black L; no cambiar precio, contenido, compra ni catálogo.",
      "approval_required": true,
      "closure_rule": "La comparación termina cuando el responsable del negocio revise días disponibles, ventas netas, devoluciones y agotados; no produce una compra automática.",
      "evidence_refs": [
        "/marts/inventory_position/32/cover_days",
        "/marts/inventory_position/24/cover_days",
        "/marts/inventory_position/30/cover_days",
        "/marts/inventory_position/18/cover_days"
      ],
      "execution": "PROHIBITED",
      "guardrail": "No declarar color ganador si faltan días en stock, tráfico comparable, devoluciones o tamaño de muestra; separar demanda censurada por agotado.",
      "id": "rank-2-color_size_observation_design",
      "population": "Grip Pilates Socks Rose S, Ivory L, Rose M, Rose L y Black L, excluyendo PRELAUNCH.",
      "primary_metric": "unidades netas vendidas por color-talla con disponibilidad observada",
      "window": "30 días consecutivos después de un conteo físico aprobado."
    },
    {
      "action": "Mantener Recovery Wrap Concept Sand como PRELAUNCH y fuera del cálculo de venta, cobertura, recompra y capital de trabajo operativo; no publicarla, venderla, ajustarla ni reabastecerla.",
      "approval_required": true,
      "closure_rule": "El responsable del negocio autoriza un cambio de lifecycle sólo con ficha de producto, inventario físico, costo, precio y canal de venta verificados.",
      "evidence_refs": [
        "/marts/inventory_position/45/stock_status",
        "/marts/inventory_position/45/cover_days"
      ],
      "execution": "PROHIBITED",
      "guardrail": "Cero inclusión de PRELAUNCH en disponibilidad comercial o compras hasta que producto, costo, precio, inventario físico y canal se aprueben.",
      "id": "rank-3-prelaunch_separation",
      "population": "Recovery Wrap Concept Sand y cualquier variante cuyo lifecycle no sea launched.",
      "primary_metric": "variantes PRELAUNCH incluidas erróneamente en decisiones operativas",
      "window": "Hasta aprobación explícita de lanzamiento por el responsable del negocio."
    }
  ],
  "request_id": "7e9246d514491d67384faa8e65c7336a61c0cd41f51a91daf9948425666f0c5f",
  "role": "merchandiser",
  "summary": "Conclusión del caso sintético: no hay una recompra base que justificar. Con un escenario provisional de 21 días de lead time más 21 días de seguridad (umbral de 42 días), la cobertura más baja entre las 36 variantes lanzadas es Grip Pilates Socks Rose S con 46.67 días; Ivory L sigue con 49.41. Rose S se prioriza sobre Rose M (64.62), Rose L (210.00) y Black L (64.62) por ser la menor cobertura, no porque su color sea preferido. Además, Rose S tiene 10 unidades en tránsito y po-00007 tiene 10 abiertas; Ivory L tiene 12 en tránsito y po-00006 tiene 12 abiertas. El capital de inventario del snapshot suma 12,836,500 centavos MXN; calcetas concentran 3,712,800 y leggings 3,696,000. El conteo y el as_of coinciden en 2026-09-21 sólo dentro de esta simulación, por lo que el siguiente paso es validar físicamente y observar ventas reales antes de proponer una compra. Recovery Wrap Concept Sand está PRELAUNCH y queda fuera de reabasto, venta y capital de trabajo operativo.",
  "unknowns": [
    "No hay conteo físico, tránsito, recepción ni existencia real confirmados; todos los saldos son simulados.",
    "No se conoce la demanda real por color, talla, canal, temporada ni la pérdida de demanda por agotado.",
    "No se dispone de costo, precio, MOQ, plazo real de proveedor, presupuesto de compra ni capital de trabajo reales.",
    "No está verificado que las calcetas sean el producto ganador ni que el catálogo/Instagram actual tenga disponibilidad o precios vigentes."
  ],
  "verdict": "REVIEW",
  "version": "2.0"
}
