{
  "challenges": [
    "La diferencia bruta de funnel no identifica causalidad y puede invertir al segmentar por intención o madurez.",
    "La tasa de repetición de agosto usa sólo 24 clientes elegibles de 36; septiembre no tiene denominador maduro.",
    "El experimento tiene intervalos Wilson amplios y superpuestos; el propio contrato prohíbe usar esa superposición como prueba formal de diferencia.",
    "El escenario sintético fue diseñado para ejercitar el sistema y no debe emplearse para priorizar gasto, inventario o mensajes reales."
  ],
  "evidence_hash": "4c5cfe6e04c75c428a99e5a589e237fde4d9331655311b85b867e87b30c21d79",
  "facts": [
    {
      "evidence_refs": [
        "/metadata/scenario"
      ],
      "id": "GROWTH-F01",
      "kind": "observation",
      "statement": "El conjunto analizado corresponde al escenario sintético normal.",
      "value": "normal"
    },
    {
      "evidence_refs": [
        "/counts/orders"
      ],
      "id": "GROWTH-F02",
      "kind": "observation",
      "statement": "La instantánea contiene 1,200 órdenes sintéticas.",
      "value": 1200
    },
    {
      "evidence_refs": [
        "/marts/funnel_conversion/1/lead_to_linked_order_rate"
      ],
      "id": "GROWTH-F03",
      "kind": "observation",
      "statement": "Instagram tiene una tasa descriptiva lead-to-linked-order de 0.4852.",
      "value": 0.4852
    },
    {
      "evidence_refs": [
        "/marts/funnel_conversion/0/lead_to_linked_order_rate"
      ],
      "id": "GROWTH-F04",
      "kind": "observation",
      "statement": "DM tiene una tasa descriptiva lead-to-linked-order de 0.3129.",
      "value": 0.3129
    },
    {
      "evidence_refs": [
        "/marts/channel_performance/1/attribution_unknown"
      ],
      "id": "GROWTH-F05",
      "kind": "observation",
      "statement": "El mart de canal marca como desconocida la atribución de ingreso de Instagram.",
      "value": 1
    },
    {
      "evidence_refs": [
        "/marts/finance_monthly/12/contribution_after_variable_cents"
      ],
      "id": "GROWTH-F06",
      "kind": "observation",
      "statement": "Septiembre de 2026 registra 2,700,622 centavos de contribución después de gasto variable en el corte sintético.",
      "value": 2700622
    },
    {
      "evidence_refs": [
        "/marts/customer_cohorts/12/repeat_within_30d_rate"
      ],
      "id": "GROWTH-F07",
      "kind": "observation",
      "statement": "La tasa de repetición a 30 días de la cohorte de septiembre permanece desconocida.",
      "value": null
    },
    {
      "evidence_refs": [
        "/experiment_analysis/experiments/0/observed_conversion_difference"
      ],
      "id": "GROWTH-F08",
      "kind": "observation",
      "statement": "La diferencia descriptiva de conversión tratamiento menos control del experimento sintético es -0.06339285714285714.",
      "value": -0.06339285714285714
    }
  ],
  "hypotheses": [
    "La brecha descriptiva entre DM e Instagram podría provenir de mezcla de intención, seguimiento, definición de lead o madurez, no necesariamente del canal.",
    "La variación de repetición entre cohortes podría reflejar censura temporal y mezcla sintética antes que una mejora persistente de retención.",
    "Un diseño con métrica primaria de contribución por visita y guardrail de devoluciones podría evitar seleccionar una variante sólo por conversión."
  ],
  "recommendations": [
    {
      "action": "Priorizar una revisión diagnóstica aprobada del tramo lead-a-orden de DM frente a Instagram, segmentando por intención y madurez antes de proponer reasignación de canal.",
      "approval_required": true,
      "closure_rule": "Cerrar como inconcluso si la cobertura o la comparabilidad difieren; elevar una propuesta sólo si la brecha persiste en segmentos predeclarados y un dueño revisa las explicaciones alternativas.",
      "evidence_refs": [
        "/marts/funnel_conversion/0",
        "/marts/funnel_conversion/1",
        "/marts/channel_performance/0/attribution_unknown",
        "/marts/channel_performance/1/attribution_unknown"
      ],
      "execution": "PROHIBITED",
      "guardrail": "Mantener attribution_unknown visible y no presentar net_revenue_cents como ingreso incremental atribuible.",
      "id": "GROWTH-R01",
      "population": "Leads elegibles de DM e Instagram bajo una definición común, excluyendo filas sin cobertura conocida.",
      "primary_metric": "lead_to_linked_order_rate por canal y segmento",
      "window": "Cuatro cortes semanales completos posteriores a una fecha de inicio aprobada."
    },
    {
      "action": "Revisar retención sólo con cohortes que hayan completado la ventana de 30 días y conservar por separado clientes elegibles e inmaduros.",
      "approval_required": true,
      "closure_rule": "Cerrar cada cohorte sólo cuando no queden observaciones requeridas fuera de ventana; mantener REVIEW si la madurez cambia el denominador.",
      "evidence_refs": [
        "/marts/customer_cohorts/11",
        "/marts/customer_cohorts/12"
      ],
      "execution": "PROHIBITED",
      "guardrail": "immature_customers y cohort_coverage_known deben permanecer visibles; una tasa nula por inmadurez no se convierte en cero.",
      "id": "GROWTH-R02",
      "population": "Clientes sintéticos de una cohorte mensual con eligible_customers_30d mayor que cero.",
      "primary_metric": "repeat_within_30d_rate entre clientes elegibles",
      "window": "Treinta días completos por cohorte, con lectura después de cerrar su ventana."
    },
    {
      "action": "Si el dueño decide evaluar la hipótesis de calcetines, aprobar primero un protocolo fijo que mida contribución por visita y no declare ganador con la viñeta sintética actual.",
      "approval_required": true,
      "closure_rule": "Cerrar con la regla estadística predeclarada y guardrails completos; si no se alcanza información suficiente o falla SRM, concluir inconcluso.",
      "evidence_refs": [
        "/experiment_analysis/experiments/0",
        "/experiment_analysis/planning_example",
        "/marts/experiment_results/0",
        "/marts/experiment_results/1"
      ],
      "execution": "PROHIBITED",
      "guardrail": "return_rate_under_10_percent, balance de asignación y cobertura de outcomes.",
      "id": "GROWTH-R03",
      "population": "Tráfico elegible definido por el dueño para una futura prueba; los 67 casos sintéticos actuales sólo prueban el sistema.",
      "primary_metric": "contribution_cents_per_visit según el contrato experimental",
      "window": "Ventana fija y tamaño aprobados antes de observar resultados; sin parada oportunista."
    }
  ],
  "request_id": "86241dc471bb7c488b937606a9f8983fef0e0cc375dbac907a2e42caf2705b55",
  "role": "growth_analyst",
  "summary": "El escenario sintético normal muestra una brecha descriptiva de funnel: Instagram registra 0.4852 órdenes vinculadas por lead y DM 0.3129, pero los cuatro canales conservan attribution_unknown=1, así que no existe base para atribuir ingreso incremental ni para declarar un canal ganador. Septiembre de 2026 registra 2,700,622 centavos MXN de contribución después de gasto variable, pero el corte es al 21 de septiembre y no debe compararse como mes completo. La retención reciente también está censurada: la cohorte de septiembre tiene 27 clientes inmaduros y tasa de repetición a 30 días nula por falta de elegibilidad. El experimento sintético observado favorece numéricamente al control en conversión por 0.06339285714285714, con sólo 32 y 35 asignaciones y estatus REVIEW; esto exige conservar la decisión abierta. El ranking propuesto prioriza diagnóstico de funnel, maduración de cohortes y un protocolo experimental previamente declarado, siempre sujeto a aprobación y sin ejecutar acciones externas.",
  "unknowns": [
    "Todos los registros son simulados; no informan demanda, adquisición, retención, contribución ni comportamiento reales de Alma de Lujo.",
    "La atribución de ingreso está marcada como desconocida en los cuatro canales, por lo que no puede estimarse retorno incremental por canal.",
    "La cohorte de septiembre todavía no tiene clientes elegibles a 30 días; agosto mezcla 24 elegibles con 12 inmaduros.",
    "El corte termina el 21 de septiembre de 2026, de modo que la contribución mensual de septiembre no es comparable con meses completos sin normalización predeclarada.",
    "El ejemplo de planeación usa supuestos de baseline 0.10 y MDE absoluto 0.03 que no han sido aprobados para una prueba real."
  ],
  "verdict": "REVIEW",
  "version": "2.0"
}
