{
  "challenges": [
    "All five period sums, all October cash components, 332 open units and their 2,089,000-cent cost valuation were independently recomputed and matched. This validates arithmetic, not the causal purchase-deferral rationale in the summary.",
    "Recommendation rank-1 should identify the full set of supplier-payment events, not imply a single 4,158,000-cent payment. The bound mart shows outflows on 24 dates.",
    "The proposed seven-day delay stays entirely within October. Its monthly primary metric is invariant; focus the protocol on the daily trough and distinguish daily movement from a minimum bank balance.",
    "The purchasing freeze and priority of payment timing require an explicit decision objective and actual constraints. Preserve them as owner-review proposals rather than deductions from positive cash-versus-profit differences."
  ],
  "evidence_hash": "829cc1dfba0e4e93ec62c626dcc64a8929e1c7fdc30f5d82fa4fa45909ab6cad",
  "facts": [
    {
      "evidence_refs": [
        "/marts/reconciliation/0/mart_cents"
      ],
      "id": "net_revenue_control",
      "kind": "observation",
      "statement": "The bound synthetic sales reconciliation reports 37,087,457 MXN cents.",
      "value": 37087457
    },
    {
      "evidence_refs": [
        "/marts/finance_monthly/1/net_cash_change_cents"
      ],
      "id": "october_cash",
      "kind": "observation",
      "statement": "The October 2025 synthetic monthly cash movement is -3,528,734 MXN cents.",
      "value": -3528734
    },
    {
      "evidence_refs": [
        "/marts/finance_monthly/1/operating_after_all_expenses_cents"
      ],
      "id": "october_operating",
      "kind": "observation",
      "statement": "October 2025 has positive synthetic operating result after expenses of 276,404 MXN cents, confirming recognition and cash differ.",
      "value": 276404
    },
    {
      "evidence_refs": [
        "/marts/reconciliation/4/mart_cents"
      ],
      "id": "supplier_control",
      "kind": "observation",
      "statement": "The bound supplier-payment reconciliation reports 4,158,000 MXN cents.",
      "value": 4158000
    },
    {
      "evidence_refs": [
        "/metadata/synthetic"
      ],
      "id": "synthetic_origin",
      "kind": "observation",
      "statement": "The reviewed workspace explicitly labels its business data synthetic.",
      "value": true
    }
  ],
  "hypotheses": [
    "The daily timing sensitivity can be a useful analytical exercise if its comparison is explicitly about daily cash movements; its monthly total cannot change when every shifted event remains inside October."
  ],
  "recommendations": [],
  "request_id": "209158682f660e0b4d08152e97df32136ab4d19d7a1a8573bfca746be8552ae1",
  "role": "evidence_reviewer",
  "summary": "The synthetic finance arithmetic and event-date reconciliation are correct. REVIEW: higher cumulative cash movement than operating result does not establish a reason to defer purchases, and no bank balance or due-date exposure is known. Independently shifting every October supplier outflow by seven days keeps the monthly movement at -3,528,734 MXN cents; it changes the daily minimum from -323,400 to -264,900 cents. The sensitivity is therefore informative about daily timing, not a demonstrated improvement in monthly liquidity or a validated purchasing priority.",
  "unknowns": [
    "Opening cash, bank balances, contractual due dates, financing constraints and real purchasing needs remain absent.",
    "Open purchase quantities valued at unit cost are not independently verified accounts payable or guaranteed receipts."
  ],
  "verdict": "REVIEW",
  "version": "2.0"
}
